,Text
2527,Entropy is the ultimate boss battle
2528,tbh smh
2529,"Great electric car documentary about early days of Tesla, GM Volt, Nissan Leaf &amp; Gadget. So much has happened since then … https://t.co/nq2nVjj5w8"
2530,Host meme review? https://t.co/k2SFtIUh1k
2531,Tap Tesla logo at top of your car’s touchscreen &amp; wait 10 secs to open special features box
2532,Still my favorite tweet of all time
2533,"Tesla Sentry Mode will play Bach’s Toccata and Fugue during a robbery (and keep Summer safe)
https://t.co/wnS5qLeB2E"
2534,Awesome moose sculpture! ♥️🇳🇴 https://t.co/CegEEHL4wz
2535,Testing metallic heat shield at 1100C (2000F) @SpaceX https://t.co/frP5eZ5a0z
2536,"If test flight of 🐉 goes well next month, @NASA 👨‍🚀 👩‍🚀 will 🚀 to @Space_Station this summer!"
2537,Tesla Sentry Mode coming soon for all cars with Enhanced Autopilot
2538,"Blood moon over LA tonight 
(@kzooastro) https://t.co/AgeMmYjss3"
2539,"The Tesla customer referral program will end on Feb 1. If you want to refer a friend to buy a Tesla &amp; give them 6 months of free Supercharging, please do so before then."
2540,Glad you like it
2541,LA is so beautiful after the rain https://t.co/caXOWAXcOM
2542,SpaceX Dragon from as seen from @Space_Station viewport https://t.co/WE82irbsmp
2543,View of SpaceX Dragon 1 berthed with @Space_Station in the last Cupola opening. Dragon 2 (Crew Dragon) launching soon.
2544,It needed to be made real
2545,Starship Hopper will do vertical flight tests similar to the Falcon 9 Hopper https://t.co/5dCrGFqymR
2546,"Starship test flight rocket just finished assembly at the @SpaceX Texas launch site. This is an actual picture, not a rendering. https://t.co/k1HkueoXaz"
2547,Tesla *with* Autopilot engaged is twice as safe &amp; continues to make steady improvements
2548,"Starting on Monday, Tesla will no longer be taking orders for the 75 kWh version of the Model S &amp; X. If you’d like that version, please order by Sunday night at https://t.co/46TXqRJ3C1"
2549,"Btw, you can buy a Tesla online in less than 2 mins &amp; give it back for a full refund for any reason https://t.co/46TXqRJ3C1"
2550,The new Roadster will actually do something like this
2551,And now … we dance! https://t.co/2TdS6EVSmi
2552,#NewProfilePic https://t.co/W4xT1ywqjA
2553,Looking forward to breaking ground on the @Tesla Shanghai Gigafactory today!
2554,Good sign that almost no Model 3 owners want to sell their cars!
2555,Falcon 9 on launch pad with Crew Dragon &amp; new astronaut walkway https://t.co/aopO67qe4F
2556,Matt DeBord reviews all Tesla models https://t.co/ZZ7KW9cPpn via @businessinsider
2557,"Starship test vehicle under assembly will look similar to this illustration when finished. Operational Starships would obv have windows, etc. https://t.co/D8AJ01mjyR"
2558,"Good shot of @SpaceX Starship flight test vehicle being assembled in Boca Chica, Texas"
2559,About a month away from the first orbital test flight of crew Dragon
2560,Three quarks for Muster Mark!
2561,…
2562,There are no coincidences https://t.co/9AEbbuXZGn
2563,"Model 3 mid-range EPA rating is actually 264 miles, slightly higher than prior estimate of 260 https://t.co/l4eCpTObAi"
2564,Great work by Tesla Team!
2565,Congratulations @Tesla team!! https://t.co/PBr9VVBv1S
2566,Haha
2567,"Good summary of Tesla progress in 2018 by @cleantechnica (due to Tesla team, not me though) https://t.co/vZgYts9auG via @cleantechnica"
2568,When one of the interns working on the simulation drops the ball …
2569,Excited to have Larry Ellison &amp; Kathleen Wilson-Thompson join the Tesla board! https://t.co/CQyvkgsCsT
2570,"Yes. Supercharger coverage will extend to 100% of Europe next year. From Ireland to Kiev, from Norway to Turkey."
2571,"Most people don’t know that the Tesla Supercharger network allows easy long distance travel throughout USA, most of Europe, Canada and China https://t.co/ZzN9Tabq8C"
2572,Reminder to US buyers that the $7500 tax credit cuts in half in 5 days! Order online at https://t.co/46TXqRrsdr to see if there is any inventory left in your region or visit Tesla stores.
2573,"Merry Christmas &amp; goodwill to all!!
⛄️ 🎄 🎁 🎅 💝 😀"
2574,Stainless Steel Starship https://t.co/rRoiEKKrYc
2575,Amazing space progress by China. This year they did more orbital launches than the USA for the first time.
2576,Engineering is true magic
2577,Please put “invented car fart” on my gravestone. This is my only request.
2578,"Tesla has released all cars for sale where original customer can’t take delivery before year end, as well as test drive / display cars, which cost less.

Reminder to US buyers that $7500 tax credit drops in half in 8 days. Order online at https://t.co/46TXqRrsdr or visit stores."
2579,"💛 Bajirao Mastani 💛
https://t.co/XbmDpiyfOP https://t.co/DZyV6S7TJZ"
2580,"Anxiety is a scalar, fear is a vector"
2581,Tesla phone app release next week will enable service scheduling in 2 mins with a few taps. No more need to call!
2582,"As a thank you to Tesla short sellers, we named a 💨 after them haha https://t.co/5GCgM4RT4W"
2583,"Perhaps lost in the transport debate is that @boringcompany built a 6000 ft tunnel in LA for ~$10M with V1 (Godot). Next tunnel will be made with V2 (Line-Storm). V3 (Prufrock), aspirationally 10X better, should be operational next year. For reference: https://t.co/LS4EhN57Mw"
2584,Join our underground movement!
2585,Are tunnels safe in an earthquake? https://t.co/vxcZ2Hi2qx
2586,Next step for @BoringCompany Loop is demonstrating high throughput at high speed. Target is 4000 vehicles/hour at 155mph (250km/h).
2587,"The demo ride takes you in *same* car on road, down elevator, zips through tunnel using guide wheels, up elevator at destination &amp; then drives on normal roads back to start"
2588,Tesla in @boringcompany tunnel with retractable wheel gear that turns a car into a rail-guided train &amp; back again https://t.co/3a6i0NoSmi
2589,Boring product launch will be streamed live at 8pm California time tonight https://t.co/bwRt49d34V
2590,Honored to work with amazing teams at SpaceX &amp; Tesla!
2591,Medieval Futurism
2592,Tesla 💨 app almost done. Important to get every note right!
2593,💕🍜 ramen is sooo good🍜 💕
2594,"Important note for US Tesla buyers: Federal tax credit drops by $3750 in 3 weeks. 

To be on the cancellation waitlist for delivery this year or if you want a display car, order at https://t.co/46TXqRJ3C1 or visit our stores. Full refund if Tesla can’t deliver your car this year."
2595,"Love that people are buying a Tesla for the product itself, even if they don’t believe in climate change. 

Not everyone can be convinced about global warming, but if an electric car is simply the best product, they don’t need to be."
2596,"If you have a Tesla built in past 2 years, definitely try Navigate on Autopilot. It will blow your mind. Automatically passes slow cars &amp; takes highway interchanges &amp; off-ramps."
2597,"Tesla history trivia: we didn’t actually come up with the Tesla Motors name. Bought trademark off Brad Siewert for $75k in late 2004. He’d originally filed for it in 1994. Our alternative name was Faraday, which was used by a competitor several years later."
2598,Boring Company product launch on Dec 18. More than a tunnel opening. Will include modded but fully road legal autonomous transport cars &amp; ground to tunnel car elevators.
2599,Tracking shot of Falcon water landing https://t.co/6Hv2aZhLjM
2600,"Engines stabilized rocket spin just in time, enabling an intact landing in water! Ships en route to rescue Falcon. https://t.co/O3h8eCgGJ7"
2601,"Grid fin hydraulic pump stalled, so Falcon landed just out to sea. Appears to be undamaged &amp; is transmitting data. Recovery ship dispatched."
2602,Falcon/Dragon launch to @Space_Station in 9 minutes
2603,"Falcon fairing halves missed the net, but touched down softly in the water. Mr Steven is picking them up. Plan is to dry them out &amp; launch again. Nothing wrong with a little swim."
2604,64 satellites 🛰 on this flight!
2605,None shall pass!
2606,♥️♥️♥️♥️🛸🛸🛸🛸♥️♥️♥️♥️ https://t.co/EX8RPQdc8r
2607,Boring breakthrough @BoringCompany https://t.co/pSflhZadwC
2608,"Super fun software Easter eggs coming to all Tesla S/3/X cars before the holidays! Romance mode, toilet humor &amp; more video games."
2609,"You can summon your Tesla from your phone. Only short distances today, but in a few years summon will work from across the continent."
2610,"Cool! Actually, if you buy a Tesla without a test drive, you have 3 days to return it. If you buy after a test drive, you still have 24 hours. Trying to incent buying with no test drive."
2611,"Join to create exciting new worlds of technology!! If getting things done matters to you, then @SpaceX, @Tesla, @BoringCompany &amp; @Neuralink are the places to be."
2612,"For those worried about running out of fresh water, it may help to know that desalination only costs 0.1 cents per liter or half a cent per gallon"
2613,"Used to live in Silicon Valley, now I live in Silicone Valley"
2614,🖤 trouble
2615,Earth is
2616,"If you don’t want a Tesla, here’s a list of all electric cars in North America https://t.co/phhBjCh2YI via @cleantechnica"
2617,"🚀 Starships were meant to fly 🚀
https://t.co/6yclRVZZFQ"
2618,Renaming BFR to Starship
2619,Tesla Supercharger capacity will double by end of next year. Expect to be within range of 95% to 100% of population in all active markets.
2620,Will allow having your car picked up &amp; dropped off or using mobile Tesla Rangers service vans if car lift isn’t needed
2621,Adding functionality to Tesla phone app allowing owners to request service for top issues with 1 or 2 taps
2622,"Btw, SpaceX is no longer planning to upgrade Falcon 9 second stage for reusability. Accelerating BFR instead. New design is very exciting! Delightfully counter-intuitive."
2623,"Set air flow to recirculating mode &amp; manually raise blower speed to 5 in Model 3 for best air quality. Air filters are smaller than S/X, so clear air is achieved by circulating through filter several times."
2624,Congratulations @BoringCompany on completing the LA/Hawthorne tunnel! Cutting edge technology! https://t.co/80WbSQekCQ
2625,Boring Company just broke through the other side!!  https://t.co/4yxQgpPVfZ
2626,Listening to Better Now https://t.co/VyCkLWkRtA
2627,"Sure hope this isn’t true. It is the non-linearities, such as Siberian permafrost melting or ocean currents changing, that are most difficult to predict."
2628,Looking back at the sun from upper stage &amp; Falcon 9 🚀 landed on drone ship Of Course I Still Love You https://t.co/sg3FXIDQJL
2629,The Boring Company is building a watchtower in LA out of dirt bricks &amp; we need a knight to yell insults at people in a French accent https://t.co/VChOVXXVaz
2630,Tesla just acquired trucking capacity to ensure Model 3 can be delivered in US by Dec 31 if ordered by Nov 30 https://t.co/npmPuSXNWC
2631,"Congratulations @SpaceX team! Thanks @NASA, much appreciated."
2632,"It naturally follows that a hotter system will have more energetic events. For example, as a pot of water becomes colder, it becomes inert ice, but heating a pot of water turns it into a steam boiler."
2633,"We know we’ll run out of dead dinosaurs to mine for fuel &amp; have to use sustainable energy eventually, so why not go renewable now &amp; avoid increasing risk of climate catastrophe? Betting that science is wrong &amp; oil companies are right is the dumbest experiment in history by far …"
2634,"If Tesla can help people in California wildfire, please let us know. Model S &amp; X have hospital grade HEPA filters. Maybe helpful for transporting people."
2635,Please lmk what you’d most like improved/fixed about your Tesla. Thanks!
2636,Mod to SpaceX tech tree build: Falcon 9 second stage will be upgraded to be like a mini-BFR Ship
2637,"I think Twitter is deleting fake, scam or maybe even inactive accounts. My follower count decreased by ~20k over the past few days."
2638,https://t.co/gt8PXloMZn
2639,Remember the future
2640,"Oh hi guys … lol
https://t.co/TX10I0Ecrn"
2641,Walked full length of Boring Co tunnel under LA tonight. Disturbingly long. On track for opening party Dec 10. Will be very one-dimensional.
2642,I remember when I was a sponge. Simpler times they were.
2643,Star Wars only had an $11M budget. Must have been in the galaxy of ridiculously low budgets. https://t.co/GcRL2uN7J7
2644,"Tesla advanced Summon ready in ~6 weeks! Just an over-the-air software upgrade, so will work on all cars made in past 2 years (Autopilot hardware V2+)."
2645,Scientists uncover Sneaky move by GM
2646,Deleted my Tesla titles last week to see what would happen. I’m now the Nothing of Tesla. Seems fine so far.
2647,Tesla Autopilot Drive on Navigation going to wide release in North America tonight
2648,"On Twitter, likes are rare &amp; criticism is brutal. So hardcore. It’s great."
2649,"Glad you’re ok @tylerthecreator 
https://t.co/ie4yBMw0tW"
2650,Fire and Ice https://t.co/ulgSZ1wlPl
2651,Time
2652,Send me ur dankest memes!!
2653,Fresh puro from my meme dealer https://t.co/EdU5uJVVne
2654,Massive thanks to Tesla owners &amp; supporters. We wouldn’t be here without you.
2655,How’d they know!? https://t.co/AZh4EOrgmc
2656,"Get this question a lot, so need to clarify that there’s no such thing as a Tesla “refresh”. Other car companies do this every ~3 years, but Tesla constantly upgrades vehicle hardware every week."
2657,"To simplify production, many Tesla Model S &amp; X interior configs, will no longer be available after Nov 1. Order now to be sure of the one you want."
2658,Twitter thought I got hacked &amp; locked my account haha
2659,i🖤anime
2660,"Order Tesla without test drive &amp; you get 3 days to return for refund, else 1 day"
2661,The first tunnel is almost done
2662,Twitter is Dark Souls of social media. Reddit is Bloodborne. Insta is Zelda.
2663,Had to been done ur welcome https://t.co/7jT0f9lqIS
2664,"Just released lower cost, mid-range Tesla Model 3 &amp; super simple new order page https://t.co/cz0TQn7IOZ"
2665,Dog saves her puppies https://t.co/czPVEwpPhi
2666,Tomorrow brings a lemur https://t.co/rm6S17h35q
2667,Special Circumstances https://t.co/Kk36qj6XJt
2668,Just reviewed Tesla’s service locations in North America &amp; realized we have major gaps in geographic coverage! Sorry for this foolish oversight. Tesla will aim to cover all regions of NA (not just big cities) within 3 to 6 months.
2669,Insightful article by David @Pogue
2670,Model 3 motor &amp; gearbox still in good condition after driving 1M miles. Designed for ultra high endurance.
2671,Works best if you play games full screen &amp; use steering wheel scroller balls for control
2672,🖤🖤🖤🖤  🚘🚘🚘🚘  🖤🖤🖤🖤
2673,It is time to create a mecha
2674,"Love Your Name
https://t.co/fRU7nTWnML"
2675,"Tesla exists to help reduce risk of catastrophic climate change, which affects all species on Earth. Even if your faith in humanity is faltering, this is worth caring about. Support makes a difference. Thank you."
2676,Teslaquila coming soon …
2677,At Falcon LZ-1 Vandenberg on Sunday night with the Base Commander. Support of @USAirForce much appreciated. https://t.co/76vsbkCN6n
2678,Studebaker Museum in South Bend https://t.co/Odti9y0McC
2679,A reminder of why it’s important to accelerate advent of cars powered by electricity made from solar power
2680,"The physics of how Tesla achieved best safety of any cars ever tested. Note, when vehicle weight is taken into account, order is more like X,S, then 3, but they are all very close."
2681,(Credit @_TomCross_) https://t.co/ZsRRVy2iDS
2682,Falcon has landed https://t.co/joqphUs1AO
2683,"Tesla owner shows how well ultrawhite seats hold up after 25,000 miles. The black &amp; white interior is def best imo. https://t.co/vWQ8X8JHYF"
2684,"Sonic boom warning. This won’t be subtle.
https://t.co/WY7dn6BBY1"
2685,Blade Runner — Esper Edition — Vangelis https://t.co/DiwsRmaDA0
2686,Tesla owners can refer someone to buy a Tesla &amp; get any image they want laser etched in glass &amp; sent to deep space for millions of years
2687,First Falcon 9 land landing mission from Vandenberg Air Force Base in California coming up soon!
2688,"People sometimes forget that a company is just a group of people gathered together to make products. So long as it makes great products, it will have great value."
2689,Just want to that the Shortseller Enrichment Commission is doing incredible work. And the name change is so on point!
2690,Great verdict 😀
2691,"Naughty by Nature 😉
https://t.co/muZdxJWjyZ"
2692,That was intense
2693,And remember … https://t.co/UaDUv4OlZf
2694,Huge thank you to all Tesla supporters for helping with car deliveries all around the world. You rock!!
2695,Sorry for difficulties delivering your Tesla due to high volume! Critical to show that environmentally sustainable is financially sustainable.
2696,♥️ Tesla Owners ♥️
2697,Mars Base Alpha https://t.co/O1llQp8rFY
2698,https://t.co/Fn0hKJd3uJ
2699,.@NHTSAgov will post final safety probability stats soon. Model 3 has a shot at being safest car ever tested.
2700,♥️ @neiltyson
2701,"True 😀
https://t.co/CS6semhKm6"
2702,"Moon mission will be livestreamed in high def VR, so it’ll feel like you’re there in real-time minus a few seconds for speed of light"
2703,Hanging out with @yousuck2020 before the @SpaceX moon mission announcement https://t.co/RTOwutzMtG
2704,Yusaku will be bringing 8 (brave) artists &amp; cultural figures with him on the journey around the moon!
2705,Thank you for your trust in the @SpaceX team. Greatly appreciated.
2706,"Due to some Tesla owners encountering system issues yesterday, the free Supercharging referral program will be extended until tomorrow night"
2707,"Btw, can’t emphasize enough how @SpaceX would not be where it is today without @NASA. Thank you."
2708,#OccupyMars
2709,https://t.co/dUpiavvM1Z
2710,https://t.co/d1KEp44zjm
2711,"Tesla is bringing most collision repairs in-house, as outside firms take weeks to months for repairs, driving Tesla owners (and us) crazy"
2712,"Tesla owners can grant free Supercharging for life to a friend who buys S/3/X. Ends tomorrow night. https://t.co/7ZDXeIQVc7"""
2713,Electric cars made with sunlight
2714,.@boringcompany will transport your car all the way into your garage
2715,"Due to a large increase in vehicle delivery volume in North America, Tesla customers may experience longer response times. Resolving this is our top priority."
2716,"Moving 2 of 7 Tesla colors off menu on Wednesday to simplify manufacturing. Obsidian Black &amp; Metallic Silver will still be available as special request, but at higher price."
2717,"Not easy coming up with a good cover story for an underground volcano lair, but I think it’s working"
2718,Test-driving our new boring machine with a 🎮
2719,"Good times with @JoeRogan …
https://t.co/8uZUsEJoq1"
2720,"Tesla 1st, 2nd &amp; 3rd in August sales"
2721,Will be on @JoeRogan at 9:30pm Pacific on Thursday
2722,"The world lost a great man in John McCain. He was an honorable, kind, brave and fundamentally decent human being. If only there were more such people in the world."
2723,This is actually real
2724,"This time, the vacuum tunnel will be a bit longer &amp; SpaceX will provide some advance funding for student teams with most promising designs. Bonus award for all race pods that exceed half the speed of sound!"
2725,"Goal is to service your car wherever you are, quietly &amp; quickly. No need to bring it to a Tesla service center."
2726,"Love born in the brain is more spirited, doubtless, than true love, but it has only flashes of enthusiasm; it knows itself too well, it criticizes itself incessantly; so far from banishing thought, it is itself reared only upon a structure of thought.
🖤The Red and The Black♥️"
2727,https://t.co/Q9JE06lmWN
2728,Really makes me wanna buy Rice Krispies
2729,Read Eliot’s notes on The Waste Land https://t.co/2SSsHiJmiO https://t.co/uToAi4kBi1
2730,Super appreciate free concert for Tesla during this intense time! 🖤🖤
2731,Great meeting you!
2732,Model 3 review by Unbox ... https://t.co/UeA9MXyva1 via @YouTube
2733,Defeating traffic is the ultimate boss battle
2734,Model 3 traction testing on pure ice &amp; snow
2735,Great Q&amp;A @defcon last night. Thanks for helping make Tesla &amp; SpaceX more secure! Planning to open-source Tesla vehicle security software for free use by other car makers. Extremely important to a safe self-driving future for all.
2736,Short shorts coming soon to Tesla merch
2737,.@defcon. hqr sz wut.
2738,Tesla deliveries &amp; AP hardware chart by @lexfridman at MIT https://t.co/6vZxKMcec2
2739,Good morning 😀
2740,Am considering taking Tesla private at $420. Funding secured.
2741,That’s right provided the two Crew Dragon test flights go well. Hardware will def be ready.
2742,Glad you’re enjoying Model 3 &amp; thanks for buying a Tesla! Major enhancements to Autopilot &amp; fun games coming in a month with V9.0.
2743,Love The Handmaiden. Director also made original Korean Oldboy. https://t.co/FtXqNflQlr
2744,Performance Model 3 review by @mattdebord https://t.co/uEA599VPcX
2745,"Dang, turns out even Hitler was shorting Tesla stock … https://t.co/RLM1VQ5O3K"
2746,Squirrels …
2747,"If you’re into video game development, consider applying to Tesla. We want to make super fun games that integrate the center touch screen, phone &amp; car irl."
2748,Some of best classic @Atari games coming as Easter eggs in Tesla V9.0 release in about 4 weeks. Thanks @Atari!
2749,Falcon 9 launches Iridium to orbit from Vandenberg Air Force Base https://t.co/7GTzx0a24d
2750,"Not having a big gas guzzler engine in front means there’s room for trunks in front &amp; back, plus longer crumple zone for best safety of any midsize car"
2751,"We tried out a new delivery system using an enclosed trailer straight from factory to owner’s home, so super convenient &amp; car arrives in pristine condition without wasting plastic wrap"
2752,8-bit floating point?
2753,"Think once, Tweet twice [do it]"
2754,Nothing is both real &amp; imaginary
2755,The future is accelerating
2756,🖤🚀💫
2757,"Worth another retweet. Hope Dan Neil returns to Twitter. He left due to relentless attacks from short-sellers, who constantly peddle fear, uncertainty &amp; doubt about Tesla. Dan won the Pulitzer &amp; is considered by many to be the best car critic in the world. https://t.co/txW3DDJpth"
2758,Wagnerian https://t.co/Mjt0bNCdIY
2759,"Mötor Trēnd
https://t.co/jilxFHjkYW"
2760,Wall Street
2761,"🦄💨✌️
https://t.co/8GjqCbsuo0"
2762,No kidding
2763,"Thanks Dan, you are a tough reviewer, so this means a lot coming from you. Please lmk even smallest nuance that can be improved."
2764,I wish
2765,Reports that I am a top donor to GOP are categorically false. I am not a top donor to any political party.
2766,Thank you for fighting climate change. This affects every living creature on Earth. https://t.co/mm0cpaQLsn
2767,Feels like a show &amp; tell weekend. I wonder what the cat dragged in …
2768,"Wrote in Grimoire, joined Fellowship https://t.co/CFYBo3ZofE"
2769,"Interesting read
https://t.co/6vvIEtYPiY"
2770,Just finished an amazing 3 day visit to China. The world has never seen human energy &amp; vigor at such scale. Incredibly impressed with Tesla China team &amp; potential for the future.
2771,"Just between us, I have a teleportation stargate to the Andromeda galaxy. It’s amazing. https://t.co/eLqr4pLeIX"
2772,So true https://t.co/DLagzIxyHm
2773,Stockholm: it’s not just a syndrome
2774,"Catching rocket fairings falling from space has proven tricky, so we made the net really big https://t.co/WMeNZeksRq"
2775,Just returned from Cave 3. Mini-sub is ready if needed. It is made of rocket parts &amp; named Wild Boar after kids’ soccer team. Leaving here in case it may be useful in the future. Thailand is so beautiful. https://t.co/EHNh8ydaTT
2776,"With some mods, this could also work as an escape pod in space"
2777,https://t.co/D1umiFDr1t
2778,Extremely talented dive team. Makes sense given monsoon. Godspeed. https://t.co/t5XRo3gTxK
2779,"Some good feedback from cave experts in Thailand. Iterating with them on an escape pod design that might be safe enough to try. Also building an inflatable tube with airlocks. Less likely to work, given tricky contours, but great if it does."
2780,"Note, no one is in the car or controlling remotely. Car is driving entirely by itself. https://t.co/xSG2Mmy756"
2781,Whoop whoop https://t.co/Xq3JlcQizc
2782,The Spice Flows https://t.co/YMyhVGIxHc
2783,"7000 cars, 7 days
♥️ Tesla Team ♥️"
2784,"Who likes short shorts?
https://t.co/hoKsDT8xdS"
2785,Excession https://t.co/h4AYwxbS3h
2786,Engineering is magic
2787,Space Laser https://t.co/8CQ6L9si3f
2788,Spacebow https://t.co/Ht4GCsaQo9
2789,The Spice. Must. Flow. https://t.co/ov4aLIwzKz
2790,Open the Knaack HAL https://t.co/EG47rvPppF
2791,Paint shop https://t.co/G2rIe1qYG4
2792,"Appreciate all the good wishes. First bday I’ve spent in the factory, but it’s somehow the best."
2793,You’re welcome! https://t.co/NcsGhhB1Ja
2794,"What would you love to see in a Tesla pickup truck? I have a few things in mind, but what do you think are small, but important nuances &amp; what would be seriously next level?"
