,Text
0,"Also, you can now change video playback speed"
1,Scrolling through tweets while watching mini video (pic in pic) is great
2,🇺🇸 For those who died for freedom 🇺🇸
3,What will AI be like in 2040? https://t.co/sDHigTkyXS
4,"Incompetence, in the limit, is indistinguishable from sabotage"
5,Transparency builds trust … https://t.co/awAHx1nGQU
6,Yikes https://t.co/qvuqX123Gt
7,Sorry this app takes up so much space https://t.co/bCCfcOhNJt
8,"AI Fashion Show in Azkaban
Date &amp; Details to Follow"
9,Office Space is an awesome movie
10,I was today’s years old when I learned that some people genuinely love cooked salmon
11,https://t.co/u2YCCPD6Az
12,Hold on to your horse as the carousel of destiny spins ever faster
13,Bruh do you even AI
14,"Is this true, @Target?"
15,https://t.co/CqtGnahpAG
16,"Lot of noise about @RonDeSantis announcing &amp; discussing his Presidential bid on this platform. 

But you what isn’t noise? Setting an all-time record for fundraising!

Worth considering for announcements in general."
17,Congratulations Neuralink team!
18,🇺🇸🇺🇸 Untamed Free Speech FTW 🇺🇸🇺🇸
19,All Presidential candidates are most welcome on this platform
20,https://t.co/YmIQZnN8o7
21,Spaces with @RonDeSantis in ~2 hours!
22,And works almost everywhere on Earth with global roaming enabled!
23,"Both quality &amp; quantity of high quality posts of all kinds (short text, long essays, pictures, audio &amp; video) have improved dramatically. 

Thank you for contributing your voice to humanity’s digital public square!"
24,"All those moments, 
will be lost in time
like tears in rain …"
25,https://t.co/QEAmqmnF93
26,Great statement by @votetimscott! https://t.co/zMy19ZQ36d
27,One hell of a plasma beam!
28,https://t.co/1QI79e1XTK
29,I have spaceships
30,AI ♾️ https://t.co/U8b6ynMGrQ
31,🤯🤯
32,I hope this platform increasingly brings you joy &amp; elucidation
33,Walter is incredibly thorough in his research. Highly recommend his other books!
34,Happens a lot https://t.co/2IjXLXJ4P3
35,Was the Internet Archive manipulated for nepotistic reasons?
36,Twitter Blue Verified subscribers can now upload 2 hour videos (8GB)!
37,Why is sleep so hard!? Perhaps we will never know. https://t.co/Jv7liqxj8I
38,https://t.co/FxOptt5Rgb
39,"To heir is human, 
To procreate divine"
40,"Love to see Starlink providing great connectivity to those who had little or nothing before. 

As soon as you can access the Internet, you can learn almost anything, so it’s absolutely essential for education.

@khanacademy being a great example."
41,https://t.co/jKxHdqc2Vp
42,Spaces interview with @davidfaber starting now
43,Tesla shareholder meeting underway
44,"As more satellites &amp; ground stations are added, latency &amp; jitter will improve. Goal is &lt;20ms latency."
45,Soros reminds me of Magneto
46,"Tesla Powerwall does the seem for individual homes (if you have the backup switch installed)
https://t.co/mY2WHe1KE1"
47,♥️♥️ Happy Mother’s Day! ♥️♥️
48,"Poetry with quill 🪶 
Written on rose 🌹 
With my blood 🩸"
49,"Until the Supreme Court struck down Biden’s vaccination decree, he tried to demand that we fire all unvaccinated personnel – some of our finest people"
50,Feels so long ago …
51,Extremely destructive if accurate https://t.co/qofFxBM29E
52,Explaining Constitutional Amendments https://t.co/oYkMPBe9Zi
53,"If AGI is almost here, why doesn’t autocorrekt work!?"
54,"Raptor V3 just achieved 350 bar chamber pressure (269 tons of thrust). Congrats to @SpaceX propulsion team!

Starship Super Heavy Booster has 33 Raptors, so total thrust of 8877 tons or 19.5 million pounds. https://t.co/ZlskpCXUmu"
55,"As soon as @LindaYacc is ready, we will do a Spaces where you can ask us anything"
56,"I am excited to welcome Linda Yaccarino as the new CEO of Twitter!

@LindaYacc will focus primarily on business operations, while I focus on product design &amp; new technology.

Looking forward to working with Linda to transform this platform into X, the everything app."
57,Wow
58,The most entertaining outcome is the most likely
59,economic enema en route
60,"Excited to announce that I’ve hired a new CEO for X/Twitter. She will be starting in ~6 weeks!

My role will transition to being exec chair &amp; CTO, overseeing product, software &amp; sysops."
61,"Super easy to use Starlink out of the box, no professional installer needed!"
62,Thanks Dave!
63,"Early version of encrypted direct messages just launched.

Try it, but don’t trust it yet."
64,https://t.co/4s6HwnCY74
65,"Also, which kind of bat – fruit eating bat or insect eating bat 🦇? https://t.co/C0uGcx7Y5U"
66,Congratulations Tesla Texas Team!!
67,https://t.co/Rm2WfVhy22
68,"With latest version of app, you can DM reply to any message in the thread (not just most recent) and use any emoji reaction. 

Release of encrypted DMs V1.0 should happen tomorrow. This will grow in sophistication rapidly. The acid test is that I could not see your DMs even if there was a gun to my head. 

Coming soon will be voice and video chat from your handle to anyone on this platform, so you can talk to people anywhere in the world without giving them your phone number."
69,"On this platform, unlike the one-way street of broadcast, people are able to interact, critique and refute whatever is said. 

And, of course, anything misleading will get @CommunityNotes. 

I also want to be clear that we have not signed a deal of any kind whatsoever. Tucker is subject to the same rules & rewards of all content creators. 

Rewards means subscriptions and advertising revenue share (coming soon), which is a function of how many people subscribe and the advertising views associated with the content.

I hope that many others, particularly from the left, also choose to be content creators on this platform."
70,Yup
71,"Trust nothing, not even nothing"
72,Massive public manipulation
73,WhatsApp cannot be trusted
74,"Interesting article. Perhaps @CommunityNotes can add further context &amp; corrections.

https://t.co/nor7Ksk70H"
75,"Your support of content creators on this platform is very much appreciated.

We keep none of the subscription revenue for the first 12 months &amp; only 10% thereafter."
76,Livestream starting soon
77,Assume you’re always being manipulated https://t.co/8aQ8bx2CzX
78,"We’re purging accounts that have had no activity at all for several years, so you will probably see follower count drop"
79,"We’re trying hard to make your feed as compelling as possible (maximize unregretted user minutes). 

How is it now vs 6 months ago?"
80,Yesterday in the pit https://t.co/NnAdSUxaBq
81,https://t.co/0WBs34BZBO
82,https://t.co/E49qQqOStT
83,🦾 https://t.co/PokrzS1O35
84,Feeling nostalgic https://t.co/kLrbTYaXPT
85,Highly recommend that organizations sign up and validate their affiliates to prevent impersonation
86,https://t.co/J9ztxdke4S
87,"NASA Spaces about space!
 https://t.co/FDqxxS52oT"
88,Falcon Heavy long exposure looks like 3 laser beams from space https://t.co/N4gUaINaNt
89,May the 4th be with you ❤️ https://t.co/jicWCJohs5
90,https://t.co/g7UiTiTPhI
91,https://t.co/KmlrLxZXCo
92,"The more screentime users spend looking at a post, whether text, pic or video, the more it is boosted. 

Video posted natively to this platform will be boosted more than an external link, because way more time is spent watching a video than clicking on a link."
93,Sunset in space
94,They are the same picture https://t.co/hGOSqQ78Wl
95,Cult / Culture
96,"Worth reading The Machine Stops by EM Forster if you haven’t already
https://t.co/sNtP0k1Qug"
97,Falcon Heavy https://t.co/g6Ix8RLgVS
98,Interview with @BillMaher https://t.co/0hpT4Sxzzj
99,https://t.co/qcsSFT2YyV
100,https://t.co/PoRcUYqa6b
101,Home https://t.co/RFJNpCicfh
102,"Rolling out next month, this platform will allow media publishers to charge users on a per article basis with one click.

This enables users who would not sign up for a monthly subscription to pay a higher per article price for when they want to read an occasional article. 

Should be a major win-win for both media orgs & the public."
103,"Major software upgrades underway across the board. 

Encrypted DMs &amp; other DM upgrades rolling out this week."
104,"Support content creators around the world in near &amp; far away places!

For many this represents a vital source of income &amp; enables them to put more time into creating great content for you."
105,I propose the lmfao test for AI
106,"About to do Falcon Heavy risk review. I love that rocket, but it’s scary. So many state changes post liftoff."
107,On @billmaher show tonight
108,"Content creators can now enable subscriptions to their text, pics &amp; video worldwide on this platform!"
109,"Anyone making materially false statements on this platform will get Community Noted, including you, me, Tucker, advertisers, head of state, etc. No exceptions. 

Convince the people and let the chips fall where they may. 

@CommunityNotes"
110,https://t.co/2zbtwJs7A8
111,The data with which the Federal Reserve is making decisions has too much latency
112,"Met with @SenSchumer and many members of Congress about artificial intelligence regulation today.

That which affects safety of the public has, over time, become regulated to ensure that companies do not cut corners. 

AI has great power to do good and evil. Better the former."
113,Verified accounts are now prioritized
114,"Sometimes, when you learn about something, you think you have it"
115,The collective mind that is this platform needs more signal &amp; less noise
116,https://t.co/RRFH30OOvt
117,"Censor not, lest ye be censored"
118,Or maybe just X
119,"We’re rapidly improving transparency &amp; fairness on this platform, but there is still a lot of work to do"
120,Hard to believe Starship actually did launch on 4/20 lol
121,"Content creators may wish to enable subscriptions on this platform. 

Just tap on Monetization in settings. https://t.co/CmD06Mczmn"
122,We live in the most interesting of times
123,https://t.co/PubSW9oJ5E
124,The least bad solution to the AGI control problem that I can think of is to give every verified human a vote
125,https://t.co/8iNKfSwC4y
126,What makes @CommunityNotes so powerful is that people with different points of view have to agree that a note is correct for it to be shown
127,check mate
128,Starship liftoff in slow motion https://t.co/KqHjqwP88Z
129,"Great song 
https://t.co/TpFcobGrch"
130,Such a great day in so many ways
131,Starship Liftoff https://t.co/X4DBvFMMrr
132,Starship Supersonic https://t.co/twI9eqLFs1
133,https://t.co/vX3M7B3J1G
134,"Congrats @SpaceX team on an exciting test launch of Starship!

Learned a lot for next test launch in a few months. https://t.co/gswdFut1dK"
135,T-0 in 4 mins https://t.co/LIMFFjQwXz
136,10 minutes to launch
137,Starship on track to launch in ~37 mins
138,All systems currently green for launch
139,Fun times 🤩
140,"Canadian Broadcasting Corp said they’re “less than 70% government-funded”, so we corrected the label https://t.co/lU1EWf76Zu"
141,"Mini Starship with flame!
https://t.co/VGKHyaikTd"
142,"Cryogenic propellant load of Starship is underway, liftoff in T minus 1 hour"
143,Starship launch attempt in ~7 hours
144,Launch attempt tomorrow https://t.co/czFsQ53Xsa
145,Yay! Nice work Dragon Team!
146,Also the plot of Deus Ex https://t.co/MhL5zLJQfn
147,💯
148,I will do a Starship Spaces at 6pm CT tomorrow for subscribers only
149,"Creators in Japan, Canada, Australia and New Zealand can now enable subscriptions on this platform. 

Our goal is to maximize the prosperity of creators!"
150,And people who steal memes! https://t.co/RNjmq4Aifo
151,The BBC interview last week was exceptional in illustrating why you cannot rely on the media for truth
152,Negative feedback received on this platform is great for reducing ego-based errors
153,https://t.co/5LwR1HoWYl
154,"Success maybe, excitement guaranteed!"
155,https://t.co/kWMCqe1gz4
156,"Once every few weeks, I will do an ask-me-anything for subscribers only"
157,"Apply to offer your followers subscriptions of any material, from longform text to hours long video!

Just tap on “Monetization” in settings."
158,Turning AI-designed fashion into real clothing would be great
159,🤣🤣
160,"NPR literally said “Federal funding is essential to public radio” on their own website (now taken down). 

What hypocrites! https://t.co/kYAXW0zpyl"
161,https://t.co/krmcbhutr0
162,This time with video &amp; better audio
163,"I said BBC could come Twitter, then, to my surprise, a reporter shows up"
164,Penetrating deep &amp; hard with @BBC
165,Doing a Twitter Spaces interview in 10 mins with the @JamesClayton5 of @BBC
166,Final date for removing legacy Blue checks is 4/20
167,X
168,We need a VP of Propaganda … errr I mean Public Relations!
169,"An advantage of having organizational affiliation on this platform is that you can change your name without losing verification.

More importantly, it helps greatly with reducing impersonation fraud."
170,"Tbh, I’m just hoping a media org that takes itself way too seriously writes a story about Harry Bōlz …"
171,"On the Internet, I’m only 3 inches tall (best case)"
172,https://t.co/zm9Sk8sLyv
173,Impersonating others is wrong!
174,Starship launch trending towards near the end of third week of April
175,"Our landlord at SF HQ says we’re legally required to keep sign as Twitter &amp; cannot remove “w”, so we painted it background color. Problem solved! https://t.co/1iFjccTbUq"
176,"Candle in rocket engine lasts ~0.1 sec

Analogies are not physics https://t.co/mhAPFnVv9p"
177,"A maximally curious AI is probably best.

The cat lobby will oppose this, naturally, but it will receive strong support from monkeys name George."
178,I’m almost there https://t.co/Sxb11nbtnh
179,Happy Easter!
180,Tesla opening Megapack factory in Shanghai to supplement output of Megapack factory in California
181,"Starship is ready for launch 🚀

Awaiting regulatory approval"
182,🤯 https://t.co/iApQi5Hw44
183,I’m proudly half Canadian! https://t.co/DLJgbGi6Dh
184,"Friendship takes work, enmity is effortless"
185,https://t.co/I5Mdo8gsaZ
186,https://t.co/4IISLswuyI
187,"Sorry, slight glitch with @SpaceX Starlink. Coming back online now."
188,https://t.co/3CsNcMZdtT
189,"Starship is stacked &amp; ready to launch next week, pending regulatory approval"
190,Starship preparing for launch  🚀 https://t.co/M1pR8rsmYt
191,Summary of argument against AI safety https://t.co/Vmg4yJm22Y
192,If the Dem Party had a time machine https://t.co/a1QE7JcGLB
193,I wish the media would stop flattering me all time … it’s a bit much guys ☺️
194,As promised https://t.co/Jc1TnAqxAV
195,https://t.co/wmN5WxUhfQ
196,They should really get rid of that 100 IQ maximum limit for creating an account on Instagram
197,MetamorphosisAI https://t.co/GvZ2etBfPL
198,Credit to Tim Sweeney for realizing this before me
199,https://t.co/Cp7efOUIPu
200,Great interview on AI
201,Walked whole Cybertruck production line at Giga Texas for several hours earlier today – gonna be awesome!
202,The real tragedy of @NYTimes is that their propaganda isn’t even interesting
203,♥️♥️ @CommunityNotes ♥️♥️
204,Me after 1 day of not eating sugar https://t.co/BP0dqyvcg1
205,Wait for it …
206,Don’t Look Up … but AGI instead of comet
207,We live in the most interesting of times
208,Twitter will be updating its recommendation algorithm based on user suggestions every 24 to 48 hours
209,"Twitter open source Spaces discussion happening now!
 https://t.co/VpS6frbOhT"
210,"Twitter recommendation source code now available to all on GitHub 
https://t.co/9ozsyZANwa"
211,"Most of the recommendation algorithm will be made open source today. The rest will follow.

Acid test is that independent third parties should be able to determine, with reasonable accuracy, what will probably be shown to users.

No doubt, many embarrassing issues will be discovered, but we will fix them fast!"
212,https://t.co/qviPxhX7n8
213,Algorithm goes open source at noon Pacific Time
214,"If you don’t like reality, just ignore it"
215,Important to establish whether someone actually belongs to an organization or not so as to avoid impersonation
216,"Old joke about agnostic technologists building artificial super intelligence to find out if there’s a God.

They finally finish &amp; ask the question.

AI replies: “There is now, mfs!!”"
217,"Forgot to mention that accounts you follow directly will also be in For You, since you have explicitly asked for them"
218,https://t.co/VGRXRwffxI
219,"Of course, you need to have good customer service for money. 

Working on it …"
220,I’m old enough to remember https://t.co/q7uY7rhEY4
221,"Starting April 15th, only verified accounts will be eligible to be in For You recommendations.

The is the only realistic way to address advanced AI bot swarms taking over. It is otherwise a hopeless losing battle.

Voting in polls will require verification for same reason."
222,The good old days https://t.co/BohnyiRj32
223,"To get Blue Check Verified for $7/month, sign up via web at https://t.co/JUTlIcVsSe"
224,"Given that modern AI can solve any “prove you’re not a robot” tests, it’s now trivial to spin up 100k human-like bots for less than a penny per account.

Paid verification increases bot cost by ~10,000% & makes it much easier to identify bots by phone & CC clustering.

Obvious conclusion: paid account social media will be the only social media that matters."
225,It’s more about treating everyone equally. There shouldn’t be a different standard for celebrities imo.
226,Prescient
227,Blooper reel must be amazing https://t.co/Z1m3yhyvrQ
228,Big congratulations to the Tesla Germany team!!
229,"20 launches done, 70+ for rest of year"
230,No but how’s your day https://t.co/xlDkwgI373
231,I’m sure it will be fine https://t.co/JWsq62Qkru
232,"To get Blue Verified for $7/month, sign up via web browser at https://t.co/JUTlIcVsSe"
233,Any individual person’s Twitter account affiliated with a verified organization is automatically verified
234,Clippy is the real paperclip problem
235,"As part of their investment, Microsoft gained exclusive access to the entire OpenAI codebase"
236,Sure would be ironic if civilization ended because of a fight over browser/search market share
237,Twitter Verified now available worldwide!
238,"Tesla Powerwall enables your home to operate normally during a power outage
https://t.co/tEE4LDCaWG"
239,Follow @HelpfulNotes to read highly rated @CommunityNotes
240,https://t.co/6LaLFNxZ9T
241,https://t.co/nhnFAAO9iO
242,A latte is really just an excuse for adults to order warm milk without sounding like a baby
243,press@twitter.com now auto responds with 💩
244,https://t.co/mZu9UEmFOB
245,https://t.co/YTKTkGvrVA
246,en tro py … en tro py … no escaping that for me
247,https://t.co/mNtI13Y3xq
248,"This platform is growing fast! 

Just exceeded 8 billion user-minutes per day … of the most influential, smartest people on Earth 😉"
249,https://t.co/x0UR77nosT
250,"In the coming weeks, Twitter will prioritize replies by:

1. People you follow
2. Verified accounts
3. Unverified accounts

Verified accounts are 1000X harder to game by bot &amp; troll armies.

There is great wisdom to the old saying: “You get what you pay for.”"
251,Very important thread
252,Engineering is true magic
253,https://t.co/6cR0kEntsV
254,https://t.co/wkZWJ5EpWa
255,Of Course I Still Love You
256,"In the months ahead, we will use AI to detect &amp; highlight manipulation of public opinion on this platform.

Let’s see what the psy ops cat drags in …"
257,Congrats to @SpaceX team for launching 2 rockets within 4 hours! https://t.co/kT5T01lxjt
258,Peace was never an option https://t.co/XgdgGeFcNy
259,Archangel-12 https://t.co/8pTabi9481
260,https://t.co/AoIYifFivh
261,"To meme the impossible meme 🎶 
To fight the unbeatable foe 🧌 
To bear with unbearable sorrow 😭
To run where the brave dare not go💨

To right, the un-rightable rong 😑 
To ♥️ pure and chaste from afar
To try when your arms are too weary 😮‍💨
To reach the unreachable ⭐️ 

This is my quest, to follow that 💫 
No matter how hopeless, no matter how far 😢 
To fight for the right without question or pause 🦾
To be willing to march into 😈 for a 😇 cause

And I know if I'll only be true to this glorious quest ⚔️ 
That my ♥️ will lie ✌️ful and 🧘
When I'm laid to rest 🪦
And 🌎 will be better for this"
262,Twitter will open source all code used to recommend tweets on March 31st
263,https://t.co/Wwp8WVIfOn
264,Describes a significant portion of this platform https://t.co/IPUfU5O6gw
265,"It’s exciting to see more &amp; more public figures engaging in active dialogue on this platform! 

Sure, people will say foolish things from time to time (myself especially), but that’s way better than silence or sanitized “press releases” that’re basically just boring propaganda."
266,"Best way to fight misinformation is to respond with accurate information, not censorship"
267,"If other party is always wrong
And your party is always right
You are at least partly wrong"
268,You’re terrible &amp; I love you
269,It’s kinda flattering to be insulted on this site tbh
270,"You can ring my bell, ring my bell"
271,Mis An Thropic Thunder
272,"Microsoft fired their AI safety team?
https://t.co/bp5vde1clm"
273,Starlink now offers global roaming
274,Funny cause it’s true https://t.co/FuIFx4Xuaq
275,https://t.co/CbxRg9r88U
276,Parents don’t realize the Soviet level of indoctrination that their children are receiving in elite high schools &amp; colleges!
277,"The intent is for this site to be fair &amp; impartial, favoring no party, seeking only the least wrong truth."
278,"Fight for truth, whole truth &amp; nothin but!"
279,Yay!!
280,“These are the good old days!” – frens
281,The sum of a cult should be greater than the parts/prophets/profits
282,Yesterday https://t.co/RP2vhWf6F3
283,https://t.co/tTMWOHcUom
284,"Chansley got 4 years in prison for a non-violent, police-escorted tour!?

Dave Chapelle was violently assaulted on stage by a guy with a knife. That guy got a $3000 fine &amp; no prison time."
285,Free Jacob Chansley
286,"To be alerted about new tweets from any account, tap the bell symbol on the profile page https://t.co/GxfsWpduwV"
287,https://t.co/IYlRo3fd59
288,Concerning
289,Sometimes we miss here at Starbase https://t.co/B9yHxzReMK
290,🤬 😂 https://t.co/zPXgj1cN5v
291,"&lt;Insert Cartridge&gt; 
&lt;Run Program&gt; https://t.co/8ZLIimykQ5"
292,Livestream interview in 15 mins at Morgan Stanley Conference https://t.co/Eo10tsAooS
293,https://t.co/KcCn6hNebl
294,"Be careful to not almost die from using this app too long on the 🚽 

I speak from experience https://t.co/p9RcAAYG89"
295,"This helpful video explains what happened at Twitter today
https://t.co/LCx4jRIiCk"
296,"Accounts engaging in repeated, egregious weaponization of DMCA on Twitter or encouraging weaponization of DMCA will receive temporary suspensions. 

That said, reasonable media takedown requests are, of course, appropriate and will always be supported."
297,Sorry for turning Twitter from nurturing paradise into place that has … trolls 🧌 https://t.co/HaWl1jPfOm
298,https://t.co/Qo6K6E1KkY
299,Add Fun to the FDA &amp; rename to FFDA
300,How to sabotage an organization … https://t.co/YWtfgfRKCu
301,"Aiming to roll out ability to reply to individual DMs, use any reaction emoji &amp; encryption later this month"
302,https://t.co/Gegpl5sjHT
303,We should defund the GEC
304,Something should be done https://t.co/17mp4XdMI0
305,169 mT to orbit this year so far
306,Another launch
307,"“I used to be in crypto, but now I got interested in AI"""
308,"The ability of Twitter advertising to reach the most influential people in the world is often not fully appreciated.

While a few other social networks are technically bigger, Twitter is where the writers &amp; leaders spend their time."
309,"Twice as many people died in Japan last year as were born. Population freefall.

Rest of the world is trending to follow.

https://t.co/JDHiFviua5"
310,https://t.co/PHv5nGLZGe
311,…
312,"You’re not gonna believe this, but we’re running a little late! 

Presentation starts in ~5 mins."
313,"What do you call an infinite gear ratio?
All torque, no action."
314,Periodic reminder to try using Twitter Lists. Will greatly improve your experience.
315,https://t.co/4raodvAzSy
316,BasedAI
317,First Starlink v2 satellites reach orbit https://t.co/0l08568mJ9
318,https://t.co/IDVrLebj20
319,"Hope you have a good Sunday. 

First day of the rest of your life."
320,Astronaut launch for @NASA tomorrow night!
321,Having a bit of AI existential angst today
322,🤯
323,Rewatching Step Brothers … so good
324,😢 https://t.co/3eGpfLlRQJ
325,https://t.co/UAWjEyhe5U
326,Why can’t witchcraft defeat inflation!?
327,https://t.co/OV8oI8vAIS
328,https://t.co/5wIbOXFs1e
329,https://t.co/mMIaVMJsfY
330,Inflation Reduction Act (IRA) vs Irish Republican Army (IRA) https://t.co/WKAftArwnW
331,https://t.co/I8f20JbkXu
332,"I have unblocked everyone I blocked, apart from scammers. I recommend others do the same.

Negative feedback is a good thing."
333,Check out my spicy 🌶️ 🔥 OnlyGANs!! https://t.co/b9lnJSEnvo
334,Cybertruck at Tesla Engineering HQ https://t.co/2xo9Hjgfk9
335,https://t.co/1512DMq10n
336,High time I confessed I let the Doge out https://t.co/TAi4p1khAd
