,Text
659,Found in closet at Twitter HQ fr 🤣🤣 https://t.co/3xSI3KvvHk
660,Wasn’t Twitter supposed to die by now or something … ?
661,"Wait, if I Tweet does that count as work?"
662,The Tactics of Mistake
663,"Twitter added 1.6M daily active users this past week, another all-time high https://t.co/Si3cRYnvyD"
664,"Holding off relaunch of Blue Verified until there is high confidence of stopping impersonation. 

Will probably use different color check for organizations than individuals."
665,Starlink now works for high latitudes
666,Tesla Megapacks are highly effective in addressing electricity demand spikes that cause power outages
667,Experience: what you get when you didn’t get what you wanted - Igor
668,Fanaticism is always a function of repressed doubt – Dune
669,"Hope all judgy hall monitors stay on other platforms – please, I’m begging u"
670,Twitter is fun 🚀 💫 ♥️
671,Our love will never die https://t.co/y5SldfAAt0
672,And lead us not into temptation … https://t.co/8qNOXzwXS9
673,"World Cup Qatar 2022: Opening Ceremony
https://t.co/TjSSitY7fK"
674,World Cup starts soon! Follow on Twitter for best coverage by far.
675,Twitter is ALIVE
676,"The people have spoken. 

Trump will be reinstated.

Vox Populi, Vox Dei."
677,The most entertaining outcome is the most likely – my variant on Occam’s Razor
678,Fascinating to watch Twitter Trump poll!
679,Tesla FSD 10.69.3.1 going to wide release now
680,Just leaving Twitter HQ code review https://t.co/pYcXRTJm14
681,Trump poll getting ~1M votes/hour!
682,Reinstate former President Trump
683,First World Cup match on Sunday! Watch on Twitter for best coverage &amp; real-time commentary.
684,"New Twitter policy is freedom of speech, but not freedom of reach.

Negative/hate tweets will be max deboosted &amp; demonetized, so no ads or other revenue to Twitter. 

You won’t find the tweet unless you specifically seek it out, which is no different from rest of Internet."
685,Freedom Fridays …
686,What should Twitter do next?
687,https://t.co/OjhQJvruTy
688,https://t.co/JU073T756X
689,https://t.co/rbwbsLA1ZG
690,🏴‍☠️
691,And … we just hit another all-time high in Twitter usage lol
692,"How do you make a small fortune in social media?

Start out with a large one."
693,Twitter is like open-sourcing the news
694,Coverage of FTX meltdown is incomparably faster *and* better quality on Twitter than old-school media
695,Punting relaunch of Blue Verified to November 29th to make sure that it is rock solid
696,Welcoming back Ligma &amp; Johnson! https://t.co/LEhXV95Njj
697,Twitter is All the News
698,Sìì!
699,Recent trend is promising https://t.co/0q7UdxSkbM
700,"Btw, I’d like to apologize for Twitter being super slow in many countries. App is doing &gt;1000 poorly batched RPCs just to render a home timeline!"
701,"Rolling out soon, Twitter will enable organizations to identify which other Twitter accounts are actually associated with them"
702,Twitter feels increasingly alive
703,Order at https://t.co/Q1VvqV5G0i!
704,🪦🤖
705,Twitter is
706,FTX meltdown/ransack being tracked in real-time on Twitter
707,"As Twitter pursues the goal of elevating citizen journalism, media elite will try everything to stop that from happening"
708,Twitter HQ is great (this is a real pic) https://t.co/qjfOQCr533
709,Quite the day!
710,"Going forward, accounts engaged in parody must include “parody” in their name, not just in bio"
711,Usage of Twitter continues to rise. One thing is for sure: it isn’t boring!
712,I love when people complain about Twitter … on Twitter 🤣🤣
713,https://t.co/FxdcXa1I7i
714,Are you seeing far fewer bots/scams/spam?
715,"Please note that Twitter will do lots of dumb things in coming months. 

We will keep what works &amp; change what doesn’t."
716,Complaint hotline operator online! Please mention your complaints below.
717,"Twitter is the worst!
But also the best."
718,https://t.co/3t5ahItE5z
719,Twitter usage is at an all-time high lol
720,"To be clear, my historical party affiliation has been Independent, with an actual voting history of entirely Democrat until this year"
721,"To independent-minded voters:

Shared power curbs the worst excesses of both parties, therefore I recommend voting for a Republican Congress, given that the Presidency is Democratic."
722,How times have changed https://t.co/gCxUkZ4kZC
723,"Twitter rules will evolve over time, but they’re currently the following: https://t.co/Ut1tXuefso"
724,"My commitment to free speech extends even to not banning the account following my plane, even though that is a direct personal safety risk"
725,Twitter needs to become by far the most accurate source of information about the world. That’s our mission.
726,Widespread verification will democratize journalism &amp; empower the voice of the people
727,"Going forward, any Twitter handles engaging in impersonation without clearly specifying “parody” will be permanently suspended"
728,Search within Twitter reminds me of Infoseek in ‘98! That will also get a lot better pronto.
729,"Twitter will soon add ability to attach long-form text to tweets, ending absurdity of notepad screenshots"
730,This rocks https://t.co/sB1sL0Hdrv
731,https://t.co/4UQlClBSct
732,"Trash me all day, but it’ll cost $8"
733,⚡️⚡️⚡️ Power to the People ⚡️⚡️⚡️
734,"Regarding Twitter’s reduction in force, unfortunately there is no choice when the company is losing over $4M/day.

Everyone exited was offered 3 months of severance, which is 50% more than legally required."
735,"Again, to be crystal clear, Twitter’s strong commitment to content moderation remains absolutely unchanged.

In fact, we have actually seen hateful speech at times this week decline *below* our prior norms, contrary to what you may read in the press."
736,Excellent summary of Twitter’s Trust &amp; Safety from the head of the team
737,"Twitter has had a massive drop in revenue, due to activist groups pressuring advertisers, even though nothing has changed with content moderation and we did everything we could to appease the activists.

Extremely messed up! They’re trying to destroy free speech in America."
738,Tiny talk is talk so small it feels like it’s coming from your own mind
739,Why is small talk even legal!?
740,A neuron doesn’t realize it’s a neuron
741,"Because it consists of billions of bidirectional interactions per day, Twitter can be thought of as a collective, cybernetic super-intelligence"
742,🎯
743,🤔 https://t.co/XuJdfMTTi1
744,https://t.co/BYOBGBHOUA
745,Advertisers should support:
746,https://t.co/kGncG7Hs3M
747,Twitter is simply the most interesting place on the Internet. That’s why you’re reading this tweet right now.
748,Being attacked by both right &amp; left simultaneously is a good sign
749,you get what you pay for
750,Twitter speaks to the inner masochist in all of us
751,"To all complainers, please continue complaining, but it will cost $8"
752,https://t.co/icg6e35LOe
753,"Twitter’s current lords &amp; peasants system for who has or doesn’t have a blue checkmark is bullshit. 

Power to the people! Blue for $8/month."
754,Sonic BOOMS!!
755,Falcon Heavy launch in ~30 mins
756,😉 https://t.co/eaIYaDRBnu
757,Halloween with my Mom https://t.co/xOAgNeeiNN
758,"If I had a dollar for every time someone asked me if Trump is coming back on this platform, Twitter would be minting money!"
759,Bring back Vine?
760,"Wachtell &amp; Twitter board deliberately hid this evidence from the court. Stay tuned, more to come … https://t.co/CifaNvtRtt"
761,This is fake – I did *not* tweet out a link to The New York Times! https://t.co/d6V6m5ATW2
762,"Just received this email from Twitter. This is an actual, real email that was autogenerated 🤣🤣 https://t.co/7DQp4sNINX"
763,"Finally, the truth that carbs are amazing can be said on this platform! 
#FreeSpeech"
764,Fresh baked bread &amp; pastries are some of the great joys of life
765,"To be super clear, we have not yet made any changes to Twitter’s content moderation policies"
766,Ligma Johnson had it coming 🍆 💦 https://t.co/CgjrOV5eM2
767,Comedy is now legal on Twitter
768,"Twitter will be forming a content moderation council with widely diverse viewpoints. 

No major content decisions or account reinstatements will happen before that council convenes."
769,🎶 let the good times roll 🎶
770,the bird is freed
771,Falcon rockets to orbit as seen from LA https://t.co/r8L2SbLC3p
772,Dear Twitter Advertisers https://t.co/GMwHmInPAS
773,Entering Twitter HQ – let that sink in! https://t.co/D68z4K2wq7
774,A beautiful thing about Twitter is how it empowers citizen journalism – people are able to disseminate news without an establishment bias
775,"“The New York Times has emerged as a new, chaotic actor in global politics. The paper’s interventions in some of the world’s most combustible conflicts have sometimes been a boon, but their messaging has also caused problems.”"
776,Works on any moving land object
777,What lesson took you the longest to unlearn?
778,διαλεκτική
779,Think about who might have decided “The Current Thing” before accepting it
780,"Who decides “The Current Thing?”
Real question. I don’t know."
781,Neuralink show &amp; tell now on Nov 30
782,"i know
|nothing|
is forever"
783,"Only Giga Berlin can make these colors, as paint shop was specially built to apply many fine layers of paint, giving it complexity not otherwise possible"
784,https://t.co/WqGm6InNTp
785,Congrats to @SpaceX team on 48th launch this year! Falcon 9 now holds record for most launches of a single vehicle type in a year.
786,"I will not let you down, no matter what it takes"
787,Vox Populi Vox Dei
788,Internet in airplanes will feel same as if you were accessing Internet at home!
789,"28,700 bottles of exquisite Burnt Hair perfume already sold! 

Only 1,300 left of this unique, limited edition, collector’s item."
790,"Drone War I
https://t.co/erVME0CbbN"
791,Exceptionally well-said
792,Are there others that want to donate Starlinks to places in need?
793,Deus X Machina
794,So true https://t.co/PwmxUVU2Fc
795,Fancy a game of meme tennis? https://t.co/d9tqIlg7nB
796,Did you hear about the dyslexic KBG agent – it’s pot secret!
797,"Pitching my idea once again for a crossover of Das Boot &amp; Boss Baby.

“Das Baby” – Hijinks on the high seas! https://t.co/FieRmSthp2"
798,"The hell with it … even though Starlink is still losing money &amp; other companies are getting billions of taxpayer $, we’ll just keep funding Ukraine govt for free"
799,Yay!!
800,"20,000!!"
801,https://t.co/WLVh5zBiO5
802,"We might need a different name, as this is basically just Starlink with roaming capability, so you can take your terminal anywhere."
803,"Please buy my perfume, so I can buy Twitter"
804,"10,000 bottles of Burnt Hair sold!"
805,Over 5000 bottles of Burnt Hair sold!
806,https://t.co/WDtHXqgUPx
807,"With a name like mine, getting into the fragrance business was inevitable – why did I even fight it for so long!?"
808,"The finest fragrance on Earth!
https://t.co/ohjWxNX5ZC https://t.co/0J1lmREOBS"
809,Maybe one day we can finally achieve https://t.co/jKBu2wJIDA
810,https://t.co/Q31B9x4RCH
811,Coming soon from The @BoringCompany https://t.co/cNIbFRRXyt
812,An eye for an eye leaves everyone blind https://t.co/pQztPvR4uI
813,https://t.co/VvGa39qAyE
814,"In case you missed Tesla AI Day 2022
https://t.co/Sbu0peXpY1"
815,SpaceX Dragon docking with @Space_Station (extended video) https://t.co/AFBDKHddgI
816,Excited to announce start of production of Tesla Semi Truck with deliveries to @Pepsi on Dec 1st! https://t.co/gq0l73iGRW
817,Starlink view of 2nd stage deorbit burn https://t.co/kbLv95bAK7
818,War is the ultimate Supreme Court
819,"Another batch of Starlinks in orbit, 7 hours after the astronaut launch"
820,"Buying Twitter is an accelerant to creating X, the everything app"
821,Let’s try this then: the will of the people who live in the Donbas &amp; Crimea should decide whether they’re part of Russia or Ukraine
822,"Ukraine-Russia Peace:

- Redo elections of annexed regions under UN supervision. Russia leaves if that is will of the people.

- Crimea formally part of Russia, as it has been since 1783 (until Khrushchev’s mistake).

- Water supply to Crimea assured.

- Ukraine remains neutral."
823,https://t.co/cGHSTdb9gv
824,https://t.co/inO8f1q38o
825,Prufrock II emerging from the ground https://t.co/csamCrmAZa
826,Do not let ancient grudge break to new mutiny
827,https://t.co/HdUl0etoao
828,"Recording of Tesla AI Day 2022 
https://t.co/7LR51x7pXa"
829,🤖 🖤 https://t.co/eNhVVztXHM
830,https://t.co/PHa7kKhFoT
831,"Naturally, there will be a catgirl version of our Optimus robot"
832,"The point of AI Day is to show the immense depth &amp; breadth of Tesla in AI, compute hardware &amp; robotics"
833,Webcast link
834,Tesla AI Day 2022 starts at precisely 6:15pm California time
835,"Cybertruck will be waterproof enough to serve briefly as a boat, so it can cross rivers, lakes &amp; even seas that aren’t too choppy"
836,"Note, this event is meant for recruiting AI &amp; robotics engineers, so will be highly technical"
837,Starlink Maritime system enables high speed Internet connectivity even in heavy seas &amp; hurricane winds https://t.co/6R4p73UGOT
838,Last coal shipment arrived in Hawaii at same time as Tesla Megapack batteries that will enable 24/7 sustainable energy https://t.co/zlqJHLsAQq
839,https://t.co/mEBAgBCCkj
840,Make “hair on fire” not just a metaphor
841,https://t.co/1hbMzueALi
842,“Burnt Hair” – Scent for Men by Singed
843,"My son, Saxon, was amazed that so many paper newspapers are still produced every day. 

He said they probably just search the Internet &amp; print it out. Yup, with rare exception, that is *actually* what they do haha."
844,https://t.co/RcKPRe8eiM
845,"Falcon 9 fairing cam captures 2nd stage plume, booster entry burn &amp; Earth in twilight https://t.co/ga9MpZKvK2"
846,https://t.co/2wpp3F31jA
847,Starlink now over 1M user terminals manufactured
848,Starlink connecting schools in the Amazon
849,"FSD Beta 10.69.2.1 looks good, extending to 160k owners in US &amp; Canada"
850,"Baltasar Gracián, Oráculo Manual y Arte de Prudencia"
851,7 engine static fire https://t.co/sOm8Jx8rJq
852,"starry, starry night 
paint your palette
blue and gray https://t.co/iUm9pzfDGc"
853,"Starlink is now active on all continents, including Antarctica 
https://t.co/Q1VvqV5G0i"
854,https://t.co/VDcpkjm56j
855,Starlink is meant for peaceful use only
856,"Salted butter is amazing, but should be stored at room temperature https://t.co/8RSr340JB8"
857,https://t.co/xMoL9wdXh6
858,"Blow the whistle!
https://t.co/RQLDti0ULZ"
859,https://t.co/qjjDVyOszp
860,My tweets are being suppressed!
861,Anyone know who the secret clients are? Let’s out them on Twitter rn haha.
862,Rome show is underappreciated https://t.co/oqd3B6O5Mw
863,🍿
864,Take a moment to … https://t.co/R3hK5u4UW6
865,Won’t be long before we view gasoline cars the same way we view steam engines today
866,"FSD Beta 10.69.2 rolling out now. Please note that top priority is safety, so expect it to be overly cautious, especially around pedestrians."
867,Falcon arching to orbit https://t.co/m7grug8FV9
868,No obvious limit to rocket reflight so far
869,Take Materials Science 101. You won’t regret it.
870,A major Fed rate hike risks deflation
871,Tesla North America aiming for &gt;50% same hour service
872,And remember 💕
873,“That’s not punny!”
874,Order a Tesla Powerwall battery for blackout protection! https://t.co/tEE4LDBD78
875,Tolkien is turning in his grave
876,https://t.co/L8gLdGE74c
877,"Sure sounds higher than 5%!
 https://t.co/Va7TxxzoI6"
878,Now launching every ~5 days
879,Spent the day walking entire Giga Berlin production line – team is doing excellent work!
880,Kickass Internet connection coming Royal Caribbean ships soon!
881,This will happen again – just a matter of time https://t.co/HeyZhZbAih
882,Godspeed Artemis!
883,"From time to time, I will share some things that seem to be working for me, in case you find it helpful"
884,"On advice of a good friend, I’ve been fasting periodically &amp; feel healthier"
885,Squeezing extra performance out of Falcon 9 – almost at 17 metric tons to an actual useful orbit with booster &amp; fairing reusable!
886,Countries should be increasing nuclear power generation! It is insane from a national security standpoint &amp; bad for the environment to shut them down.
887,Population collapse due to low birth rates is a much bigger risk to civilization than global warming
888,"Starlink V2, launching next year, will transmit direct to mobile phones, eliminating dead zones worldwide"
889,Livestream of big news in about an hour
890,This is something special
891,The course of civilization is not always upward https://t.co/8mr7pFWcnI
892,Mechazilla loads Starship on launchpad https://t.co/LfkfjpAcZj
893,https://t.co/KsWiazActx
894,Neuralink progress update show &amp; tell on October 31 st (Halloween)
895,"2 main goals this year: 

- Starship to orbit
- FSD wide release

Many other things, of course, but those are the 2 giant kahunas. Will require insane work by many super talented people, but, if anyone can do it, they can. 

It is an honor to work with such awesome human beings."
896,👿 https://t.co/hdzRzphcii
897,"After wide release of FSD Beta 10.69.2, price of FSD will rise to $15k in North America on September 5th. 

Current price will be honored for orders made before Sept 5th, but delivered later."
898,"FSD Beta 10.69 started rolling out to Tesla owners last night. This build is a big step forward!

10.69.1 probably end of week with wider release.

1069.2 in a few weeks should be good enough to provide to all FSD Beta participants."
899,"Nice letter from Bill Nix, who would’ve been my prof at Stanford if I hadn’t put grad studies on (permanent) deferment https://t.co/ioq0mGwN7K"
900,Still so grateful 🥹 https://t.co/EhdyXw4fqN
901,https://t.co/KBjnfkU4ia
902,🎶 This Magic Moment 🎶
903,Being a Mom is just as important as any career
904,Highly Recommend https://t.co/nrDZ4gJqEE
905,Standup is my side-hustle
906,"To be clear, I support the left half of the Republican Party and the right half of the Democratic Party!"
907,Congrats Giga Shanghai on making millionth car! Total Teslas made now over 3M. https://t.co/2Aee6slCuv
908,Just Read The Instructions https://t.co/BWYzSEE0Q8
909,Adding the 13 inner engines https://t.co/ooOFEGl0Hr
910,Another orbital plane of polar satellites
911,This will be Mars one day https://t.co/nf4hML8dKx
912,but have u seen my sex tape https://t.co/aCBqIRz4sH
913,Starship B7 static fire https://t.co/taBpsd9LSV
914,Fate 🖤 Irony https://t.co/RHZ9BEws7k
915,deep thot https://t.co/0EcPd30QAs
916,https://t.co/UfZdHZvtAA
917,8 years ago https://t.co/HPK5R5UMS6
918,Wrote this 6 years ago https://t.co/r9GdXpCtZU
919,https://t.co/67gqPGe7Ph
920,Quite the day
921,https://t.co/1duQL9NU2E
922,FSD Beta 10.69 drops on 8/20
923,Saxon James Musk https://t.co/d7FKw4iQIU
924,Less than 5% of Twitter daily users are fake/spam
925,Moving rocket to launch pad https://t.co/nPVq1tyLoy
926,Hustling to get Starship Booster 7 back to pad to test outer ring of 20 engines
927,Full Send Podcast https://t.co/01FmxYRrVr
928,Thank goodness for Senator Manchin
929,The ratio of digital to biological compute is growing fast. Worth tracking.
930,Just came across this pretty good CNBC piece on SpaceX &amp; Starship https://t.co/RELYzC40M9
931,Worth reading. This is a close match for my philosophy.
932,Still time to vote!
933,https://t.co/2Ck4z96NFM
934,"If our reality is actually an alien soap opera, our ratings would be 🚀💥💫"
935,Maybe free some people in jail for weed here too? https://t.co/AYo0ZC79lZ
936,Off to the Races set to Harley Quinn https://t.co/79XaBOxAKk
937,Tesla + Twitter -&gt; Twizzler
938,Interaction with almost all twitter accounts seem to be much lower in recent weeks &amp; days. Accurate?
939,Saxon https://t.co/UTh4uqIEYP
940,Friend made this for me 2 years ago https://t.co/XzlmpmPNT7
941,Try voice command “open butthole” on your Tesla
942,https://t.co/Uo30yDO3tJ
943,Heatwave in Shortville 🥵
944,"I can’t say for sure that Starship will reach escape velocity, but my hubris certainly has"
945,Inflation might be trending down
946,Much harder to make friends than enemies. My skill at the latter is improving.
947,The media is a click-seeking machine dressed up as a truth-seeking machine
948,"A new philosophy of the future is needed. I believe it should be curiosity about the Universe – expand humanity to become a multiplanet, then interstellar, species to see what’s out there."
949,All Teslas come with a free karaoke app https://t.co/mZa3WmhyPL
950,"Single-piece casting reduces weight, greatly simplifies factory, increases ride quality &amp; reduces road noise"
951,What video games have you enjoyed most over past year or two?
952,"Movie idea: Boss Baby meets Das Boot
Das Baby – “Hijinks on the High Seas!”"
953,"The dark origin of the lemming mass suicide myth …
https://t.co/wn7vg2mUjr"
954,https://t.co/TpGbs06lnT
955,Gehalt und Gestalt
956,Excited to work with Tesla Service to enable same-hour service as often as possible! Applying Formula 1 pit crew techniques to Teslas.
957,"Starlink now available in 36 countries!
https://t.co/nH1zPfd2Om"
958,Congrats to SpaceX team on record number of launches!
959,Optimus Primed https://t.co/DMIPaIYevN
960,🥇 https://t.co/VlSpfXZdp9
961,One of the best features of Model X
962,Congrats to Tesla Fremont + Giga Nevada for making their 2 millionth car!
963,Please vote your shares with Tesla!
964,https://t.co/8IYBfjFact
965,"Tesla is to protect life on Earth,
SpaceX to extend life beyond."
966,"Mars may be a fixer upper of a planet, but it has great potential!"
967,https://t.co/ozWk7GxcEu
968,Dragon launching in 2 mins
969,A+ for cinematography https://t.co/anGjQKbq5W
970,Starship launch site tonight https://t.co/Len70RGCNf
971,Excited about @NASAWebb potential!
972,Oh the irony lol
973,"Tesla’s automatic cabin overheat protection should make a real difference with record heatwaves.

Ability to adjust activation temperature coming with next software release."
974,https://t.co/mvVUR4doqB
975,"For improved quality of sleep, raise head of your bed by about 3” or 5cm and don’t eat 3 hours before bedtime"
976,These polar launches will enable complete coverage of Earth (where approved by local government)
977,https://t.co/d5tSnoDs5s
978,https://t.co/JcLMee61wj
979,Super fired up for future product development with our awesome Tesla team! Such an honor to work with them.
980,Starlink for boats!
981,Maybe Tesla should make a highly configurable Robovan for people &amp; cargo?
982,I hope you have big families and congrats to those who already do!
983,Population of Mars is still zero people!
984,"Doing my best to help the underpopulation crisis. 

A collapsing birth rate is the biggest danger civilization faces by far."
985,"Highly recommend Revolutions by Mike Duncan, especially Season 10 https://t.co/LoJXYL2HTU"
986,Humanity will reach Mars in your lifetime
987,Flatulence Earther
988,A veritable “sock aficionado”
989,I must confess to a penchant for creative socks
990,Elvis is just Elvish without an h
991,Happy July 4th! https://t.co/KYN2XO712Z
992,https://t.co/sUrsfucQ2F
993,Honored to meet @Pontifex yesterday https://t.co/sLZY8mAQtd
994,"Venice, a site of Great Remembrance https://t.co/GWR3xqsoQW"
995,Feeling … perhaps … a little bored?
996,Wise words from SJM https://t.co/snVNttsvn1
997,https://t.co/YhpHKcCYXz
998,AI gets better every day https://t.co/Lz5XfXRJjh
999,What … is your favorite cheese?
1000,I will keep supporting Dogecoin
1001,💕💕 shadow crew 💕💕
1002,Happy Father’s Day
1003,Congrats to SpaceX Falcon team for executing 3 flawless launches in 2 days!
1004,We’re changing Starlink’s default wifi name to Stinky
1005,"This is where 
the writers are,

Of past,
Present,
And Future."
1006,Feels like déjà vu all over again haha
1007,Congratulations to Giga Berlin team on making over 1000 cars in a week!
1008,"Watch the opening scene of Idiocracy. 

When I ask my friends why they’re not yet having kids (very few are), it sounds exactly like the movie.

https://t.co/528L1mhHi1"
1009,Is TikTok destroying civilization? Some people think so.
1010,https://t.co/oD5D5CVe5A
1011,"Our best landing video to date, thanks to Starlink!"
1012,"I’m dressing as a sink on Halloween, as they will have no choice but to let me in"
1013,Original Top Gun is a great movie. Just rewatched. Looking forward to seeing the sequel.
1014,Starship SN24 in the High Bay https://t.co/vDZ4yBV1MF
1015,Cryptonight
1016,https://t.co/adMlWpAfz1
1017,"Don’t build moats, build tech trees"
1018,True experts even read wiki citations https://t.co/MDU2oYmTpH
1019,Make Austin weirder!
1020,Humor is one of the great joys of life!
1021,"33 Raptor rocket engines, each producing 230 metric tons of force https://t.co/flQLb62MgZ"
1022,Play video games wherever you want
1023,Real talk https://t.co/A0VPuWgzAg
1024,https://t.co/2ELe1W5ZXC
1025,YouTube seems to be nonstop scam ads
1026,"What resolution is life in, 8k? – SJM"
1027,If chess was released as a video game https://t.co/8SuK8Mg7yT
1028,The acid test for any two competing socioeconomic systems is which side needs to build a wall to keep people from escaping? That’s the bad one!
